id,link,content,date,retweets,favorites,mentions,hashtags,Trump or biden
1.22116E+18,https://twitter.com/JoeBiden/status/1221163328300408832,"One of my favorite parts of the campaign trail is meeting folks across the country and hearing their stories. So my team and I are picking one lucky person to sit down with me for a cup of joe.

Chip in today for your chance to win: https://t.co/IYZ70gr2h9 https://t.co/YKzqbOMTvs",1/25/2020 20:10,265,1046,,,Biden
1.22118E+18,https://twitter.com/JoeBiden/status/1221176414625509377,"Happy Lunar New Year to all those celebrating throughout the country. I'm grateful for the contributions that the AAPI community has made to enrich America's diversity. I hope the Year of the Rat brings good fortune, health, and happiness to all.",1/25/2020 21:02,296,1497,,,Biden
1.2212E+18,https://twitter.com/JoeBiden/status/1221195476843868160,"Every American deserves access to safe, clean drinking water. We have to hold polluters accountable and rid our water of unsafe levels of these chemicals for good. https://t.co/j5d6pvPBtb",1/25/2020 22:17,911,3120,,,Biden
1.22121E+18,https://twitter.com/JoeBiden/status/1221213660191739904,"Firefighters represent the best of America É?? they put their lives on the line every single day and selflessly rush toward danger to save others.

I'm grateful for the endorsement of @IAFFNewsDesk. There's no group of people I'd rather stand with. https://t.co/KXWOONKaXl",1/25/2020 23:30,688,2347,,,Biden
1.22122E+18,https://twitter.com/JoeBiden/status/1221222865783132160,"The seas are rising. Australia is burning. And in this moment of crisis, our President thinks windmills cause cancer. Solving the climate crisis, starts with beating Donald Trump. And once I do, we'll pass my ambitious climate plan. https://t.co/uClGwalbRW",1/26/2020 0:06,988,3947,,,Biden
1.22151E+18,https://twitter.com/JoeBiden/status/1221513133321150464,"Make no mistake: Our best days still lie ahead. If we come together and act as one America, there's nothing that we can't accomplish.",1/26/2020 19:20,1237,7221,,,Biden
1.22156E+18,https://twitter.com/JoeBiden/status/1221556054141669382,Jill and I are sending our prayers to the Bryant family and to everyone who lost loved ones in todayÉ??s crash. ItÉ??s a reminder of how special É?? and fragile É?? life is. And itÉ??s a reminder that weÉ??ve got to make every day count.,1/26/2020 22:10,5767,46725,,,Biden
1.22166E+18,https://twitter.com/JoeBiden/status/1221657342204350464,"Congrats @MichelleObama on winning a Grammy for telling your story with strength É?? and with grace. Jill and I are so thrilled for you. Just beat Barack to an EGOT, will ya? https://t.co/EpDsGz4KYj",1/27/2020 4:53,3136,29642,,,Biden
1.22185E+18,https://twitter.com/JoeBiden/status/1221852279097171968,"I'm grateful to have the endorsement of the @scj. The battle for the soul of this nation begins in Iowa É?? and I'm confident that together, we'll make Donald Trump a one-term president and take back this country. https://t.co/xbARVjoFU6",1/27/2020 17:47,356,1575,,,Biden
1.22188E+18,https://twitter.com/JoeBiden/status/1221880050951176192,Climate change poses an existential threat to our future É?? and we are running out of time to address it. We have to get Donald Trump out of the White House and rally the world to meet the urgency of this moment. https://t.co/7kNfqn3EGi,1/27/2020 19:38,724,2520,,,Biden
1.22189E+18,https://twitter.com/JoeBiden/status/1221890408009084936,"Selling off public services to private interests at the expense of workers and their communities should be a non-starter. Congratulations to the members of @ATUComm, who went on strike for 84 days to fight for their rights É?? and won. https://t.co/EJ4JglWcuB",1/27/2020 20:19,237,722,,,Biden
1.22191E+18,https://twitter.com/JoeBiden/status/1221906978332561408,"On #HolocaustMemorialDay and the 75th anniversary of Auschwitz's liberation, we honor the millions of Jews and other victims whose lives were extinguished by the Nazi regime. Today and every day, we must give hate no safe harbor to ensure such atrocities never again occur.",1/27/2020 21:25,523,2221,,,Biden
1.22194E+18,https://twitter.com/JoeBiden/status/1221938435511836673,"With just one week until the Iowa Caucus, we need your help to bring us across the finish line. Every door knocked, phone call made, or dollar chipped in goes a long way in this homestretch. Head to https://t.co/ie4bECkx0e to get involved. https://t.co/7F1dyHYd4V",1/27/2020 23:30,319,932,,,Biden
1.22195E+18,https://twitter.com/JoeBiden/status/1221954793481990145,Let's be clear: Donald Trump's Muslim ban was never about safety É?? it was a blatant ploy to fan the flames of bigotry and score points with his political base. I will end it.,1/28/2020 0:35,4781,29422,,,Biden
1.22199E+18,https://twitter.com/JoeBiden/status/1221987724095361024,"No family in search of a better life should be denied permanent residency because they don't meet Donald Trump's wealth test.

The United States of America should be open and welcome to all É?? not just the wealthy. https://t.co/ocJREvqcQd",1/28/2020 2:45,1661,6820,,,Biden
1.22201E+18,https://twitter.com/JoeBiden/status/1222007101389770759,"Iowa caucus-goers take note. Joni Ernst just spilled the beans. She and Donald Trump are scared to death IÉ??ll be the nominee. On Feb. 3rd, letÉ??s make their day. https://t.co/FKrqfxDW9L",1/28/2020 4:02,6343,23259,,,Biden
1.22221E+18,https://twitter.com/JoeBiden/status/1222213749857234946,"Health care is personal to me. Deeply personal. And I guarantee you that if I'm elected president, I will protect your family's health care as if it were my own familyÉ??s. https://t.co/Uj15uqjsCi",1/28/2020 17:44,1431,5174,,,Biden
1.22224E+18,https://twitter.com/JoeBiden/status/1222241683938725888,Let's remember one thing when it comes to impeachment: Donald Trump is on trial because he's afraid to run against me. He knows IÉ??ll beat him this November.,1/28/2020 19:35,7076,39948,,,Biden
1.22231E+18,https://twitter.com/JoeBiden/status/1222307450495389696,"Iowans, on Feb. 3rd, you have a chance for a twofer. You can ruin Donald Trump's night, and you can ruin Senator ErnstÉ??s, too. https://t.co/NU8hk2TOAf",1/28/2020 23:56,3927,12557,,,Biden
1.22232E+18,https://twitter.com/JoeBiden/status/1222323147418017794,A peace plan requires two sides to come together. This is a political stunt that could spark unilateral moves to annex territory and set back peace even more. I've spent a lifetime working to advance the security &amp; survival of a Jewish and democratic Israel. This is not the way. https://t.co/H6IhtP1YJd,1/29/2020 0:58,2409,8279,,,Biden
1.22233E+18,https://twitter.com/JoeBiden/status/1222333539049332736,"Imagine all the progress we could make in the next four years. We could make health care a right, lead on climate change, and get assault weapons out of our schools. It could all be a reality É?? but first, we have to beat Donald Trump. https://t.co/O0FZ2Z1nlx",1/29/2020 1:40,1213,4617,,,Biden
1.22235E+18,https://twitter.com/JoeBiden/status/1222346121944715267,Donald TrumpÉ??s demonstrated failures of judgment and his repeated rejection of science make him the worst possible person to lead our country through a global health challenge. https://t.co/PH4vF5taDa,1/29/2020 2:30,1681,6388,,,Biden
1.22256E+18,https://twitter.com/JoeBiden/status/1222561289790246912,"Climate is on the ballot. If we donÉ??t get Donald Trump out of the White House and take action now to address the climate crisis, our planet may never recover. https://t.co/Xu0IrxdYTQ",1/29/2020 16:45,863,2874,,,Biden
1.2226E+18,https://twitter.com/JoeBiden/status/1222602815505301510,"I need your help if we're going to restore the soul of this nation. With the Iowa Caucuses just days away, your donation is more important than ever.

Chip in $5 to help fuel our campaign: https://t.co/HlWMIhCyki https://t.co/RfI3EuTCcI",1/29/2020 19:30,1198,3383,,,Biden
1.22263E+18,https://twitter.com/JoeBiden/status/1222633013068161025,The decision to allow the Trump Administration to discriminate against immigrants based on wealth is a cruel betrayal of our values. The next four years could have a generational impact on our federal courts É?? we have to make Donald Trump a one-term president.,1/29/2020 21:30,1118,5326,,,Biden
1.22266E+18,https://twitter.com/JoeBiden/status/1222655410005397504,We need a president who respects religious freedom. https://t.co/5PrjnXCig5,1/29/2020 22:59,653,2996,,,Biden
1.22267E+18,https://twitter.com/JoeBiden/status/1222666986317942789,Equal pay for equal work is common sense É?? and long overdue. That's why the Lilly Ledbetter Fair Pay Act was the first law that the Obama-Biden Administration signed 11 years ago today. We have to continue the fight until we close the gender pay gap once and for all.,1/29/2020 23:45,384,1692,,,Biden
1.22269E+18,https://twitter.com/JoeBiden/status/1222685860497215488,"I've spent my entire life bringing people together to get big, difficult things done. And I intend to do that as your president É?? unifying our country at the moment we need it most. ThereÉ??s no limit to what we could do if we come together. https://t.co/DTgRBe7X6H",1/30/2020 1:00,775,2927,,,Biden
1.22269E+18,https://twitter.com/JoeBiden/status/1222691999364657152,"Donald Trump has slammed the door shut in the face of families fleeing persecution and violence. On day one, I will eliminate President TrumpÉ??s decision to limit asylum and end the MPP program. #RestoreAsylumNOW https://t.co/3KLjtwEtNE",1/30/2020 1:24,519,1669,,,Biden
1.2227E+18,https://twitter.com/JoeBiden/status/1222698443463782400,The true character of a person is revealed in the Oval Office. We saw it with President Obama. We're seeing it with President Trump É?? and what we've witnessed from this president over the last three years makes clear that we can't give him another four. https://t.co/SEb3XztnKI,1/30/2020 1:50,4565,17800,,,Biden
1.22272E+18,https://twitter.com/JoeBiden/status/1222724095051214848,"As IÉ??ve said many times, health care is deeply personal to me, like it is for so many Americans. IÉ??m proud to stand with @SEIU1199NW to fight for safe staffing, patient care, and fair pay. https://t.co/IpSMdg3mgw",1/30/2020 3:31,309,1167,,,Biden
1.22293E+18,https://twitter.com/JoeBiden/status/1222926194502447104,Ending gun violence is on the ballot. We have to take on the powerful gun lobby and pass common-sense measures that will keep our kids safe. I've beaten the @NRA twice É?? and I'll do it again as president. https://t.co/lrgFPskUrf,1/30/2020 16:55,547,1902,,,Biden
1.22295E+18,https://twitter.com/JoeBiden/status/1222950101724864515,"ItÉ??s no understatement to say that Donald Trump represents an existential threat to the future of our country. He has repeatedly shown little understanding of É?? and zero regard for É?? our laws, our values, or our democracy.

We have to get him out of the White House.",1/30/2020 18:30,3033,13588,,,Biden
1.22299E+18,https://twitter.com/JoeBiden/status/1222988102270013440,"In four days, Iowans will gather in every corner of the state to set our nation on the path to picking the next president. It's a big responsibility É?? and we need your help to talk with as many folks as possible about what's at stake. Take action today: https://t.co/0yBebrK3rY",1/30/2020 21:01,342,1102,,,Biden
1.22303E+18,https://twitter.com/JoeBiden/status/1223025600459231232,We can't let Donald Trump define us as a nation É?? we are so much better than who he thinks we are. LetÉ??s choose to be the more perfect union we've always aspired to be and restore the soul of this nation. https://t.co/zqQnWXRPcN,1/30/2020 23:30,2312,7304,,,Biden
1.22305E+18,https://twitter.com/JoeBiden/status/1223049506775883777,"With just four days until Iowa and one day until our critical end-of-month fundraising deadline É?? your support has never been more important. Every donation É?? big or small É?? goes a long way in this final stretch.

Chip in today to help fuel our campaign: https://t.co/WHzkM56Sas",1/31/2020 1:05,209,629,,,Biden
1.22306E+18,https://twitter.com/JoeBiden/status/1223062089582940162,"Donald Trump is the most erratic and incompetent commander in chief we've ever had. After four years of his self-made chaos, we'll need a president who is ready to clean up the mess on day one. https://t.co/TCOjc3aubF",1/31/2020 1:55,2984,11567,,,Biden
1.22307E+18,https://twitter.com/JoeBiden/status/1223073414568562688,The character of a president matters É?? and we have to make that clear this November. https://t.co/hQobfKY7Fx,1/31/2020 2:40,1166,3995,,,Biden
1.22308E+18,https://twitter.com/JoeBiden/status/1223078215301967876,"Airline catering workers will feed thousands of people traveling to the Super Bowl, but canÉ??t afford to feed their own families. I stand in solidarity with @unitehere_sofla. @AmericanAir needs to ensure @LSGSkyChefs pay their workers living wages. https://t.co/4nx9nYHoET",1/31/2020 2:59,316,989,,,Biden
1.22329E+18,https://twitter.com/JoeBiden/status/1223286098052485121,"Let's be clear: If Donald Trump can afford to give giant tax breaks to the super-wealthy, then he can afford to ensure that the most vulnerable in our society receive the health care they need and deserve.

We should be expanding Medicaid É?? not cutting it. https://t.co/akawD7sV8f",1/31/2020 16:45,725,2300,,,Biden
1.2233E+18,https://twitter.com/JoeBiden/status/1223299854849445888,.@JohnDelaney ran his campaign with conviction to make our government work for the American people. He will continue to be an important voice in shaping our country for years to come. https://t.co/Dqg0D7s0p7,1/31/2020 17:39,131,655,,,Biden
1.22332E+18,https://twitter.com/JoeBiden/status/1223323814290870272,"Time and time again, Donald Trump has proven he has no moral rudder. Instead of having respect for others, he insults and demeans. He preys on divisions and stokes hate, instead of healing and uniting.

Trump is everything we aspire not to be as Americans.",1/31/2020 19:15,1773,8154,,,Biden
1.22335E+18,https://twitter.com/JoeBiden/status/1223351496877793280,"I've stood up to bullies my entire life, and I'm ready to stand up to the one in the White House. I hope President Trump heard that message loud and clear when he saw this ad air during Fox &amp; Friends this morning. https://t.co/TImcrK1T48",1/31/2020 21:05,3343,12752,,,Biden
1.22338E+18,https://twitter.com/JoeBiden/status/1223375404351787008,"Donald Trump's Muslim ban is a direct betrayal of AmericaÉ??s most fundamental freedom: religious freedom. And now he's adding more countries to his list of who's not welcome in America.

It's not who we are É?? and we'll prove that when we beat Trump this November and end the ban. https://t.co/qdlU5P7MZQ",1/31/2020 22:40,676,1999,,,Biden
1.22339E+18,https://twitter.com/JoeBiden/status/1223390503527469056,"America's character is on the ballot. We can overcome four years of Donald Trump, but if given eight years in the White House, he will forever and fundamentally alter the character of this nation. We can't let that happen. https://t.co/TnQrX0hCUi",1/31/2020 23:40,2309,7004,,,Biden
1.2234E+18,https://twitter.com/realDonaldTrump/status/1223399034552930305,"No matter what you give to the Democrats, in the end, they will NEVER be satisfied. In the House, they gave us NOTHING!",1/31/2020 18:13,35765,187686,,,Trump
1.22338E+18,https://twitter.com/realDonaldTrump/status/1223381882902986752,Democrats = 17 Witnesses. Republicans = 0 Witnesses.,1/31/2020 17:05,33322,158977,,,Trump
1.22335E+18,https://twitter.com/realDonaldTrump/status/1223351951963967488,"The Radical Left, Do Nothing Democrats keep chanting É??fairnessÉ?ù, when they put on the most unfair Witch Hunt in the history of the U.S. Congress. They had 17 Witnesses, we were allowed ZERO, and no lawyers. They didnÉ??t do their job, had no case. The Dems are scamming America!",1/31/2020 15:06,42134,177564,,,Trump
1.22325E+18,https://twitter.com/realDonaldTrump/status/1223252952787361792,Incredible numbers!https://twitter.com/realDonaldTrump/status/1223099086389121026 É??,1/31/2020 8:33,25211,110642,,,Trump
1.22325E+18,https://twitter.com/realDonaldTrump/status/1223250897414905856,"Nadler ripped final argument away from Schiff, thinks Shifty did a terrible job. They are fighting big time!https://twitter.com/Julio_Rosas11/status/1223090988060758021 É??",1/31/2020 8:25,22812,88605,,,Trump
1.2231E+18,https://twitter.com/realDonaldTrump/status/1223099086389121026,THE BEST IS YET TO COME!pic.twitter.com/SOn6wRV9Zs,1/30/2020 22:22,27684,107167,,,Trump
1.22308E+18,https://twitter.com/realDonaldTrump/status/1223082623351713792,"Americans across the political spectrum are disgusted by the Washington DemocratsÉ?? Partisan Hoaxes, Witch Hunts, & Con Jobs. Registered Democrats and Independents are leaving the Democrat Party in droves, & we are welcoming these voters to the Republican Party w/ wide open arms!pic.twitter.com/UCdQXY3vPn",1/30/2020 21:16,20124,74448,,,Trump
1.22308E+18,https://twitter.com/realDonaldTrump/status/1223080264747737088,"Washington Dems have spent the last 3 years trying to overturn the last election É?? and we will make sure they face another crushing defeat in the NEXT ELECTION. Together, we are going to win back the House, we are going to hold the Senate, & we are going to keep the White House!pic.twitter.com/VshQceiwUA",1/30/2020 21:07,16577,61663,,,Trump
1.22308E+18,https://twitter.com/realDonaldTrump/status/1223079479393697792,"To keep America Safe, we have fully rebuilt the U.S. Military É?? it is now stronger, more powerful, and more lethal than ever before. Thanks to the courage of American Heroes, the ISIS Caliphate has been DESTROYED & its founder & leader É?? the animal known as al-Baghdadi É?? is DEAD!pic.twitter.com/9LXDf6mJKf",1/30/2020 21:04,14110,58507,,,Trump
1.22308E+18,https://twitter.com/realDonaldTrump/status/1223077157779464195,"This November, we are going to defeat the Radical Socialist Democrats and win the Great State of Iowa in a Historic Landslide! # KAG2020pic.twitter.com/jYIbSdyGjU",1/30/2020 20:54,23447,96905,,,Trump
1.22308E+18,https://twitter.com/realDonaldTrump/status/1223075454027993088,"Thank you Iowa, I love you!https://www.pscp.tv/w/cQOMgDEzNTg4Mzh8MXZPeHdvYkxCQUx4QrT6MSzbemiKv0jhIMKEWz80dLpl7urO3cn8NWkS7psa?t=56s É??",1/30/2020 20:48,18643,85293,,,Trump
1.22304E+18,https://twitter.com/realDonaldTrump/status/1223038027234267137,"Great poll in Iowa, where I just landed for a Big Rally! # KAG2020pic.twitter.com/4YCo01XYCn",1/30/2020 18:19,18014,70749,,,Trump
1.223E+18,https://twitter.com/realDonaldTrump/status/1223004106408833025,"Working closely with China and others on Coronavirus outbreak. Only 5 people in U.S., all in good recovery.",1/30/2020 16:04,22010,133719,,,Trump
1.223E+18,https://twitter.com/realDonaldTrump/status/1223002606664065030,"Leaving Michigan now, great visit, heading for Iowa. Big Rally!",1/30/2020 15:58,11637,72486,,,Trump
1.22298E+18,https://twitter.com/realDonaldTrump/status/1222982067799121926,"BIGGEST TRADE DEAL EVER MADE, the USMCA, was signed yesterday and the Fake News Media barely mentioned it. They never thought it could be done. They have zero credibility!",1/30/2020 14:37,30456,141831,,,Trump
1.22298E+18,https://twitter.com/realDonaldTrump/status/1222981385520140288,"Just landed in Michigan. Car companies, and many others, are building and expanding here. Great to see!",1/30/2020 14:34,16099,98220,,,Trump
1.22298E+18,https://twitter.com/realDonaldTrump/status/1222976037165961216,Happy birthday today to two of the very best in CongressÉ?? @ RepMikeJohnson (age 48) and @ RepLeeZeldin (age 40É??big one!). Two Great American Patriots!!,1/30/2020 14:13,8516,39883,,,Trump
1.22298E+18,https://twitter.com/realDonaldTrump/status/1222975645447348225,"Congressman @ MichaelCBurgess has done a Great job representing the people of Texas. He continues to protect your very important Second Amendment. Mike is Strong on Crime and the Border, he Loves our Great Vets and Military. Mike has my Complete and Total Endorsement!",1/30/2020 14:11,11464,41147,,,Trump
1.22298E+18,https://twitter.com/realDonaldTrump/status/1222975359722803201,"Congressman Brian @ Babin4Congress of Texas has been a strong supporter of our # MAGA Agenda. He is strong on the Second Amendment and Securing our Border, he Loves our Great Vets and Military. Brian has my Complete and Total Endorsement!",1/30/2020 14:10,10569,36193,,,Trump
1.22297E+18,https://twitter.com/realDonaldTrump/status/1222973224092258304,"Great photos from a SOUTHERN BORDER WALL Briefing with Secretary of Defense, Mark @ EsperDoD!pic.twitter.com/rpGHpdoIa6",1/30/2020 14:01,10243,41082,,,Trump
1.22291E+18,https://twitter.com/realDonaldTrump/status/1222907250383245320,É??Schiff blasted for not focusing on California homeless.É?ù @ foxandfriends His District is in terrible shape. He is a corrupt pol who only dreams of the Impeachment Hoax. In my opinion he is mentally deranged!,1/30/2020 9:39,27079,119914,,,Trump
1.22267E+18,https://twitter.com/realDonaldTrump/status/1222672488934584324,"Just received a briefing on the Coronavirus in China from all of our GREAT agencies, who are also working closely with China. We will continue to monitor the ongoing developments. We have the best experts anywhere in the world, and they are on top of it 24/7!pic.twitter.com/rrtF1Stk78",1/29/2020 18:06,16716,71625,,,Trump
1.22267E+18,https://twitter.com/realDonaldTrump/status/1222670731080863745,Nancy Pelosi wants Congress to take away authority Presidents use to stand up to other countries and defend AMERICANS. Stand with your Commander in Chiefs!,1/29/2020 17:59,34663,159493,,,Trump
1.22267E+18,https://twitter.com/realDonaldTrump/status/1222670610867916804,"With Votes in the House tomorrow, Democrats want to make it harder for Presidents to defend America, and stand up to, as an example, Iran. Protect our GREAT COUNTRY!",1/29/2020 17:59,24983,116543,,,Trump
1.22266E+18,https://twitter.com/realDonaldTrump/status/1222655839573565440,GAME OVER!pic.twitter.com/yvMa6bPqfy,1/29/2020 17:00,54495,165641,,,Trump
1.2226E+18,https://twitter.com/realDonaldTrump/status/1222601464889200653,"For the first time in American History, we have replaced a disastrous Trade Deal that REWARDED outsourcing with a truly FAIR and RECIPROCAL Trade Deal that will keep jobs, wealth and growth right here in AMERICA!pic.twitter.com/bDe8IV9DyD",1/29/2020 13:24,17440,64933,,,Trump
1.2226E+18,https://twitter.com/realDonaldTrump/status/1222600757389725698,"Thanks to our pro-worker, pro-American economic policies, unemployment is at the lowest level in more than 50 years. We have created over 7 MILLION new JOBS. More Americans are working today than EVER before. We have the hottest ECONOMY on earth!pic.twitter.com/TRGKRF7xgQ",1/29/2020 13:21,15733,60229,,,Trump
1.22259E+18,https://twitter.com/realDonaldTrump/status/1222589891785175041,"USMCA is a cutting edge state of the art agreement that protects, defends and serves the great people of our Country. Promises Made, Promises Kept!pic.twitter.com/PuiG1JPTTI",1/29/2020 12:38,13473,51421,,,Trump
1.22259E+18,https://twitter.com/realDonaldTrump/status/1222589334739673088,USMCA is a massive win for American manufacturers and auto workers!pic.twitter.com/eOgFm31cAo,1/29/2020 12:36,14534,59534,,,Trump
1.22255E+18,https://twitter.com/realDonaldTrump/status/1222547304491646976,They will never be satisfied!https://twitter.com/realDonaldTrump/status/1222344928530968576 É??,1/29/2020 9:49,16318,67697,,,Trump
1.22255E+18,https://twitter.com/realDonaldTrump/status/1222546813099659264,É??The best evidence is the Transcript itself.É?ù Brad Blakeman @ FoxNews,1/29/2020 9:47,13562,64517,,,Trump
1.22254E+18,https://twitter.com/realDonaldTrump/status/1222544696964263936,"There is much talk that certain Democrats are going to be voting with Republicans on the Impeachment Hoax, so that the Senate can get back to the business of taking care of the American people. Sorry, but CryinÉ?? Chuck Schumer will never let that happen!",1/29/2020 9:39,17089,78719,,,Trump
1.22254E+18,https://twitter.com/realDonaldTrump/status/1222543172192129024,"On the Iraq War Resolution being voted on tomorrow in the House of Represenatives, we are down to 5000 soldiers, and going down, and I want everyone, Republican and Democrat, to vote their HEART!",1/29/2020 9:33,20466,104748,,,Trump
1.22251E+18,https://twitter.com/realDonaldTrump/status/1222509768683720706,"Mark Penn, Harris Poll: É??ItÉ??s time to end the Impeachment Trial.É?ù @ foxandfriends Just another political Hoax by the Dems!",1/29/2020 7:20,13615,61185,,,Trump
1.2225E+18,https://twitter.com/realDonaldTrump/status/1222503732501499904,"Remember Republicans, the Democrats already had 17 witnesses, we were given NONE! Witnesses are up to the House, not up to the Senate. DonÉ??t let the Dems play you!",1/29/2020 6:56,30145,122839,,,Trump
1.2225E+18,https://twitter.com/realDonaldTrump/status/1222496715422433281,"....many more mistakes of judgement, gets fired because frankly, if I listened to him, we would be in World War Six by now, and goes out and IMMEDIATELY writes a nasty & untrue book. All Classified National Security. Who would do this?",1/29/2020 6:28,18146,76832,,,Trump
1.2225E+18,https://twitter.com/realDonaldTrump/status/1222496705763008515,"For a guy who couldnÉ??t get approved for the Ambassador to the U.N. years ago, couldnÉ??t get approved for anything since, É??beggedÉ?ù me for a non Senate approved job, which I gave him despite many saying É??DonÉ??t do it, sir,É?ù takes the job, mistakenly says É??Libyan ModelÉ?ù on T.V., and..",1/29/2020 6:28,20223,89745,,,Trump
