id,link,content,date,retweets,favorites,mentions,hashtags,Trump or biden
1.22249E+18,https://twitter.com/realDonaldTrump/status/1222487526780346370,Democrats admitting the Impeachment Hoax!https://twitter.com/DanScavino/status/1220047531272364037 É??,1/29/2020 5:51,22141,65840,,,Trump
1.22248E+18,https://twitter.com/realDonaldTrump/status/1222484885627076610,Thank you!https://twitter.com/jerseygirl007rn/status/1221889690464219137 É??,1/29/2020 5:41,8864,46978,,,Trump
1.22239E+18,https://twitter.com/realDonaldTrump/status/1222385653029261312,"Why didnÉ??t John Bolton complain about this É??nonsenseÉ?ù a long time ago, when he was very publicly terminated. He said, not that it matters, NOTHING!",1/28/2020 23:07,20780,102801,,,Trump
1.22234E+18,https://twitter.com/realDonaldTrump/status/1222344928530968576,"No matter how many witnesses you give the Democrats, no matter how much information is given, like the quickly produced Transcripts, it will NEVER be enough for them. They will always scream UNFAIR. The Impeachment Hoax is just another political CON JOB!",1/28/2020 20:25,37843,158553,,,Trump
1.22233E+18,https://twitter.com/realDonaldTrump/status/1222333993892315137,"If you want your children to inherit the blessings that generations of Americans have fought and died to secureÉ??then we must devote everything we have toward victory in 2020. Only this way, can we save the America we love É?? and drain the Washington Swamp once and for all!pic.twitter.com/5NeC0mFWfU",1/28/2020 19:41,28438,102404,,,Trump
1.22233E+18,https://twitter.com/realDonaldTrump/status/1222332975825793025,"Democrats are now the party of high taxes, high crime, open borders, late-term abortion, socialism, and blatant corruption. The Republican Party is the party of the American Worker, the American Family, and the American Dream! # TrumpRallyNJ # KAG2020pic.twitter.com/Kq5KFhQmgH",1/28/2020 19:37,15815,53060,,,Trump
1.22233E+18,https://twitter.com/realDonaldTrump/status/1222331749805580293,"Thank you Wildwood, New Jersey! # KeepAmericaGreathttps://www.pscp.tv/w/cQDX1zEzNTg4Mzh8MW1uR2VReVhtVm5HWH0g36sNHJMqVn88PUIxQYA-7lkGjCRunp6PU0CL2C-d?t=24s É??",1/28/2020 19:32,13380,52783,,,Trump
1.22228E+18,https://twitter.com/realDonaldTrump/status/1222284074066366464,"ItÉ??s amazing what IÉ??ve done, the most of any President in the first three years (by far), considering that for three years IÉ??ve been under phony political investigations and the Impeachment Hoax! KEEP AMERICA GREAT!",1/28/2020 16:23,28330,147767,,,Trump
1.22228E+18,https://twitter.com/realDonaldTrump/status/1222282422110154753,"Heading to New Jersey. Big Rally, in fact, Really Big Rally!",1/28/2020 16:16,18154,111359,,,Trump
1.22227E+18,https://twitter.com/realDonaldTrump/status/1222267800732995585,https://twitter.com/WhiteHouse/status/1222243101164625926 É??pic.twitter.com/vSV0YPyQrg,1/28/2020 15:18,13530,48476,,,Trump
1.22224E+18,https://twitter.com/realDonaldTrump/status/1222235349117755395,The Witch Hunt continues!https://twitter.com/joelpollak/status/1222229447157239809 É??,1/28/2020 13:09,12395,46630,,,Trump
1.22222E+18,https://twitter.com/realDonaldTrump/status/1222224528065155072,"This is what a future State of Palestine can look like, with a capital in parts of East Jerusalem.pic.twitter.com/39vw3pPrAL",1/28/2020 12:26,8596,28585,,,Trump
1.22222E+18,https://twitter.com/realDonaldTrump/status/1222224521958187009,???¯?? ???? ???? ?¶?????? ???????? ???????? ?Å?????˙???? ?????????¶?????????? ???????Ê???? ?Å?? ?ú?™?˝???≠ ???? ?????????? ???????Ò??????.pic.twitter.com/CFuYwwjSso,1/28/2020 12:26,10500,41806,,,Trump
1.22222E+18,https://twitter.com/realDonaldTrump/status/1222223636779741184,I will always stand with the State of Israel and the Jewish people. I strongly support their safety and security and their right to live within their historical homeland. It's time for peace!pic.twitter.com/lKwQ9IKTUG,1/28/2020 12:23,9678,37002,,,Trump
1.22222E+18,https://twitter.com/realDonaldTrump/status/1222223630056206336,?¶?????? ?ê?õ?????? ?????? ???????ˇ?¶ ???????ê?? ?????õ?ù ????????????. ?ê?ˇ?? ?¶?????? ???????????? ?????????????¶?ù ???????????ˇ?ù ???????????¶?ù ?????????¶ ???????????¶?ù ???????≠?????????¶. ???????õ ???????? ?????????ù!pic.twitter.com/AtNnQtnGZs,1/28/2020 12:23,10199,46363,,,Trump
1.22222E+18,https://twitter.com/realDonaldTrump/status/1222219667697213441,https://www.pscp.tv/w/cQBvvDFvTlFsTFJub1dwUXd8MW1ueGVReUVyVk54WA1zKet_7z8vzWFt8Te_Oj1SHWia5RzDd-o1zJWDHKC7 É??,1/28/2020 12:07,8465,28516,,,Trump
1.22219E+18,https://twitter.com/realDonaldTrump/status/1222186473849544704,"The Fed should get smart & lower the Rate to make our interest competitive with other Countries which pay much lower even though we are, by far, the high standard. We would then focus on paying off & refinancing debt! There is almost no inflation-this is the time (2 years late)!",1/28/2020 9:55,19239,82616,,,Trump
1.22218E+18,https://twitter.com/realDonaldTrump/status/1222184371932798976,Are you better off now than you were three years ago? Almost everyone say YES!,1/28/2020 9:47,30112,209475,,,Trump
1.22218E+18,https://twitter.com/realDonaldTrump/status/1222183788924502017,".....So, what the hell has happened to @ FoxNews. Only I know! Chris Wallace and others should be on Fake News CNN or MSDNC. HowÉ??s Shep Smith doing? Watch, this will be the beginning of the end for Fox, just like the other two which are dying in the ratings. Social Media is great!",1/28/2020 9:44,16925,61138,,,Trump
1.22218E+18,https://twitter.com/realDonaldTrump/status/1222183788211470336,"Really pathetic how @ FoxNews is trying to be so politically correct by loading the airwaves with Democrats like Chris Van Hollen, the no name Senator from Maryland. He has been on forever playing up the Impeachment Hoax. Dems wouldnÉ??t even give Fox their low ratings debates....",1/28/2020 9:44,19604,82197,,,Trump
1.22203E+18,https://twitter.com/realDonaldTrump/status/1222028267865223170,"Don Lemon, the dumbest man on television (with terrible ratings!).https://twitter.com/DailyCaller/status/1221999373829144578 É??",1/27/2020 23:26,39628,153572,,,Trump
1.22202E+18,https://twitter.com/realDonaldTrump/status/1222015204315336705,"Charlie, I always knew you are brilliant!https://twitter.com/CharlesHurt/status/611237885346467841 É??",1/27/2020 22:35,10962,50609,,,Trump
1.22201E+18,https://twitter.com/realDonaldTrump/status/1222009264396558336,Thank you to Chuck & all. USMCA is going to be GREAT!https://twitter.com/GrassleyPress/status/1220364541046992899 É??,1/27/2020 22:11,8968,35608,,,Trump
1.22201E+18,https://twitter.com/realDonaldTrump/status/1222008772102705152,"Thank you Roger, it is a big Hoax!https://twitter.com/SenatorWicker/status/1221932726674231299 É??",1/27/2020 22:09,10531,48128,,,Trump
1.22201E+18,https://twitter.com/realDonaldTrump/status/1222007302636654593,Congrats to Christine!https://twitter.com/Dr_Mark_Peters/status/1220531644773199872 É??,1/27/2020 22:03,3941,19451,,,Trump
1.22201E+18,https://twitter.com/realDonaldTrump/status/1222006774368296960,"A full & complete Endorsement for @ RepDonBacon, who is doing a great job. Strong on crime, loves our Military, Vets & 2A!https://twitter.com/SenatorFischer/status/1221945829050781696 É??",1/27/2020 22:01,6088,24803,,,Trump
1.22186E+18,https://twitter.com/realDonaldTrump/status/1221858276058566661,https://www.pscp.tv/w/cP8fJDFvTlFsTFJub1dwUXd8MXlOeGFRYWxOTXF4aquAXfhiQ6kMbEuRCG78KwaZeoudtLiTH1gAF68fdR2o É??,1/27/2020 12:11,14168,47179,,,Trump
1.22184E+18,https://twitter.com/realDonaldTrump/status/1221842613487251458,"On International Holocaust Remembrance Day, we remember the millions of precious souls who perished as a result of the horrific crimes perpetrated by the Nazi regime....https://www.whitehouse.gov/briefings-statements/presidential-message-international-holocaust-remembrance-day-2020/ É??",1/27/2020 11:09,18920,77670,,,Trump
1.22181E+18,https://twitter.com/realDonaldTrump/status/1221813147918569474,Senate hearing on the Impeachment Hoax starts today at 1:00 P.M.,1/27/2020 9:12,13682,72865,,,Trump
1.22181E+18,https://twitter.com/realDonaldTrump/status/1221809170673958913,"We are in very close communication with China concerning the virus. Very few cases reported in USA, but strongly on watch. We have offered China and President Xi any help that is necessary. Our experts are extraordinary!",1/27/2020 8:56,22449,119113,,,Trump
1.22181E+18,https://twitter.com/realDonaldTrump/status/1221805273695780864,"Schiff must release the IG report, without changes or tampering, which is said to be yet further exoneration of the Impeachment Hoax. He refuses to give it. Does it link him to Whistleblower? Why is he so adamant?",1/27/2020 8:40,33811,129999,,,Trump
1.22179E+18,https://twitter.com/realDonaldTrump/status/1221790577446019072,READ THE TRANSCRIPTS!,1/27/2020 7:42,20738,122295,,,Trump
1.22176E+18,https://twitter.com/realDonaldTrump/status/1221764212873224193,"The Democrat controlled House never even asked John Bolton to testify. It is up to them, not up to the Senate!",1/27/2020 5:57,18792,94783,,,Trump
1.22166E+18,https://twitter.com/realDonaldTrump/status/1221663763138588672,"I NEVER told John Bolton that the aid to Ukraine was tied to investigations into Democrats, including the Bidens. In fact, he never complained about this at the time of his very public termination. If John Bolton said this, it was only to sell a book. With that being said, the...",1/26/2020 23:18,27850,119011,,,Trump
1.22166E+18,https://twitter.com/realDonaldTrump/status/1221663764031905793,"...transcripts of my calls with President Zelensky are all the proof that is needed, in addition to the fact that President Zelensky & the Foreign Minister of Ukraine said there was no pressure and no problems. Additionally, I met with President Zelensky at the United Nations...",1/26/2020 23:18,15405,67243,,,Trump
1.22166E+18,https://twitter.com/realDonaldTrump/status/1221663764971491329,...(Democrats said I never met) and released the military aid to Ukraine without any conditions or investigations - and far ahead of schedule. I also allowed Ukraine to purchase Javelin anti-tank missiles. My Administration has done far more than the previous Administration.,1/26/2020 23:18,15876,68184,,,Trump
1.22158E+18,https://twitter.com/realDonaldTrump/status/1221582230008619016,"Kobe Bryant, despite being one of the truly great basketball players of all time, was just getting started in life. He loved his family so much, and had such strong passion for the future. The loss of his beautiful daughter, Gianna, makes this moment even more devastating....",1/26/2020 17:54,89988,716997,,,Trump
1.22158E+18,https://twitter.com/realDonaldTrump/status/1221582230990073856,.....Melania and I send our warmest condolences to Vanessa and the wonderful Bryant family. May God be with you all!,1/26/2020 17:54,32173,251823,,,Trump
1.22154E+18,https://twitter.com/realDonaldTrump/status/1221535503868223488,Reports are that basketball great Kobe Bryant and three others have been killed in a helicopter crash in California. That is terrible news!,1/26/2020 14:48,36434,242370,,,Trump
1.22153E+18,https://twitter.com/realDonaldTrump/status/1221533043153915904,"Nothing done wrong, READ THE TRANSCRIPTS!",1/26/2020 14:39,17177,106144,,,Trump
1.22152E+18,https://twitter.com/realDonaldTrump/status/1221523477003456512,Majority of people say É??the U.S. Senate already has enough information!É?ù @ FoxNews,1/26/2020 14:01,14651,79673,,,Trump
1.22147E+18,https://twitter.com/realDonaldTrump/status/1221469014427348992,"95% Approval Rating in the Republican Party. Thank you! 191 Federal Judges (a record), and two Supreme Court Justices, approved. Best Economy & Employment Numbers EVER. Thank you to our great New, Smart and Nimble REPUBLICAN PARTY. Join now, itÉ??s where people want to be!",1/26/2020 10:24,25133,116417,,,Trump
1.22146E+18,https://twitter.com/realDonaldTrump/status/1221464712321347585,"Sleepyeyes Chuck Todd of Meet the Corrupt Press, just had a É??totallyÉ?ù softball interview with conman Adam Schiff, never even calling Shifty out on his fraudulent statement to Congress, where he made up ALL of the words of my conversation with the Ukrainian President! FAKE NEWS",1/26/2020 10:07,23468,99058,,,Trump
1.22145E+18,https://twitter.com/realDonaldTrump/status/1221454586717839366,"After having been exposed as a fraud and corrupt, can anyone, including Sleepyeyes Chuck Todd of Fake @ NBCNews, continue to listen to his con?",1/26/2020 9:27,13829,61750,,,Trump
1.22145E+18,https://twitter.com/realDonaldTrump/status/1221449400834252800,"É??Again: Read the Transcript!É?ù Michael Goodwin, New York Post, Sunday.",1/26/2020 9:06,11490,54513,,,Trump
1.22144E+18,https://twitter.com/realDonaldTrump/status/1221443936952233984,"Great Editorial in todayÉ??s Wall Street Journal, É??And Congress Shall Be King.É?ù Bottom line: É??The President becomes a vassal of King Congress. This is another reason for the Senate to repudiate this House Impeachment as its own abuse of power.É?ù A partisan Hoax!",1/26/2020 8:45,15857,63674,,,Trump
1.22144E+18,https://twitter.com/realDonaldTrump/status/1221438768256823296,Why didnÉ??t Schiff release this?https://twitter.com/marklevinshow/status/1221046836435345409 É??,1/26/2020 8:24,16437,50929,,,Trump
1.22144E+18,https://twitter.com/realDonaldTrump/status/1221436736594681856,A very good question!https://twitter.com/marklevinshow/status/1221423157749452800 É??,1/26/2020 8:16,18432,69836,,,Trump
1.22143E+18,https://twitter.com/realDonaldTrump/status/1221433469559103489,"É??This is what Democrats have done. They want to create the idea that there is all this smoke so people think thereÉ??s fire. They did this with Russia Collusion, & there was no fire. It makes zero sense what the Democrats are accusing him of.É?ù @ LisaMarieBoothe @ foxandfriends",1/26/2020 8:03,13919,56682,,,Trump
1.22143E+18,https://twitter.com/realDonaldTrump/status/1221431369923997697,É??It was amazing to watch three days of arguments dismantled in two hours.É?ù @ PeteHegseth @ foxandfriends,1/26/2020 7:55,14511,65521,,,Trump
1.22143E+18,https://twitter.com/realDonaldTrump/status/1221426584646815744,"Paul Krugman is a lightweight thinker who doesnÉ??t have a clue. Caused huge economic damage to his followerÉ??s pocketbooks. He, and others, should be fired by @ nytimes!https://twitter.com/larryelder/status/1221272485410131969 É??",1/26/2020 7:36,11224,45197,,,Trump
1.22142E+18,https://twitter.com/realDonaldTrump/status/1221423557722431489,Rep. Jim Jordan Delivers Knockout Blow to SchiffÉ??s Reputationhttps://thegreggjarrett.com/rep-jim-jordan-delivers-knockout-blow-to-schiffs-reputation/ É??,1/26/2020 7:24,11913,42193,,,Trump
1.22142E+18,https://twitter.com/realDonaldTrump/status/1221422761597394944,"Shifty Adam Schiff is a CORRUPT POLITICIAN, and probably a very sick man. He has not paid the price, yet, for what he has done to our Country!",1/26/2020 7:20,32518,142181,,,Trump
1.22142E+18,https://twitter.com/realDonaldTrump/status/1221419910175301633,"The Impeachment Hoax is a massive election interference the likes of which has never been seen before. In just two hours the Radical Left, Do Nothing Democrats have seen their phony case absolutely shredded. Shifty is now exposed for illegally making up my phone call, & more!",1/26/2020 7:09,23228,98360,,,Trump
1.22128E+18,https://twitter.com/realDonaldTrump/status/1221283457004982272,True!https://twitter.com/SenJohnBarrasso/status/1221161217286381568 É??,1/25/2020 22:07,9726,37733,,,Trump
1.22126E+18,https://twitter.com/realDonaldTrump/status/1221255245117952000,All Democrats should watch this!pic.twitter.com/WFK33pR0Lv,1/25/2020 20:15,44906,124625,,,Trump
1.22125E+18,https://twitter.com/realDonaldTrump/status/1221247332529975297,???˝???Ò ???????Ò ?????Ò?™?? ?????Ò???? ???? ???????? ?????Ò???? ?????????¶???Ò ???¯?????Ò?? ???? ???????????¶ ???¶?????? ?????¶ ?????? ???? ?????????? ???? ?¶???Ò???? ???? ???Ò???????¶?? ??????. @ FoxNews @ OANN ?????? ???Ò????!https://twitter.com/realDonaldTrump/status/1221225245220265985 É??,1/25/2020 19:43,16745,65779,,,Trump
1.22123E+18,https://twitter.com/realDonaldTrump/status/1221225245220265985,"Iranian Foreign Minister says Iran wants to negotiate with The United States, but wants sanctions removed. @ FoxNews @ OANN No Thanks!",1/25/2020 18:16,24598,106178,,,Trump
1.22119E+18,https://twitter.com/realDonaldTrump/status/1221192511139581959,"Previous quote from the great Republican Senator, Jim Inhofe, of Oklahoma - Chairman of the Senate Armed Services Committee",1/25/2020 16:05,7597,35606,,,Trump
1.22119E+18,https://twitter.com/realDonaldTrump/status/1221190416201969665,....at the judges that we have right now.,1/25/2020 15:57,9859,48132,,,Trump
1.22119E+18,https://twitter.com/realDonaldTrump/status/1221190398846152708,"É??You donÉ??t come to court and ask for witnesses after youÉ??ve already presented your case, unless you know your case is not working. I think their real motivation is for them to keep this President busy. WeÉ??re doing a great job on the economy, weÉ??re building our military, look.....",1/25/2020 15:57,23926,116208,,,Trump
1.22117E+18,https://twitter.com/realDonaldTrump/status/1221172563117772800,Martha is a great leader on this issue!https://twitter.com/SenMcSallyAZ/status/1221136652505997312 É??,1/25/2020 14:46,8286,35970,,,Trump
1.22117E+18,https://twitter.com/realDonaldTrump/status/1221170219172945920,Three great men!https://twitter.com/SenMcSallyAZ/status/1220726485079797761 É??,1/25/2020 14:37,7340,29807,,,Trump
1.22116E+18,https://twitter.com/realDonaldTrump/status/1221163769239392261,Such a great family!https://twitter.com/CissieGLynch/status/956982424554131461 É??,1/25/2020 14:11,7040,38805,,,Trump
1.22116E+18,https://twitter.com/realDonaldTrump/status/1221156910730293254,Thank you Nick!https://twitter.com/toddstarnes/status/1221108090684264448 É??,1/25/2020 13:44,19715,99982,,,Trump
1.22114E+18,https://twitter.com/realDonaldTrump/status/1221140946320084995,"Any fair minded person watching the Senate trial today would be able to see how unfairly I have been treated and that this is indeed the totally partisan Impeachment Hoax that EVERYBODY, including the Democrats, truly knows it is. This should never be allowed to happen again!",1/25/2020 12:41,29865,133958,,,Trump
1.22108E+18,https://twitter.com/realDonaldTrump/status/1221079753760833536,"Our case against lyinÉ??, cheatinÉ??, liddleÉ?? Adam É??ShiftyÉ?ù Schiff, CryinÉ?? Chuck Schumer, Nervous Nancy Pelosi, their leader, dumb as a rock AOC, & the entire Radical Left, Do Nothing Democrat Party, starts today at 10:00 A.M. on @ FoxNews, @ OANN or Fake News @ CNN or Fake News MSDNC!",1/25/2020 8:37,28471,113342,,,Trump
1.22108E+18,https://twitter.com/realDonaldTrump/status/1221075142404644864,"É??I like President TrumpÉ??s Tweets (Social Media), I like everything about him...and this Ukraine stuff, the trial, the impeachment, this isnÉ??t t about Ukraine. Donald Trump has committed the two unpardonable sins in the eyes of the Democrats. He beat Hillary Clinton in 2016, and..",1/25/2020 8:19,19972,92563,,,Trump
1.22108E+18,https://twitter.com/realDonaldTrump/status/1221075143117721600,"....secondly, he is fulfilling every promise he made, and that is making his opponents apoplectic. TheyÉ??re trying to get him out of office, and theyÉ??re not going to succeed.É?ù Pastor Robert Jeffress, author of É??Choosing the Extraordinary LifeÉ?ù Thank you Pastor! @ LouDobbs @ FoxBus",1/25/2020 8:19,14270,63286,,,Trump
1.22107E+18,https://twitter.com/realDonaldTrump/status/1221070105230094336,"The Great @ LouDobbs: É??People know, after 3 years of this President, the most historic President in our CountryÉ??s history, that there is no one who can touch what heÉ??s done in 3 years, foreign policy, domestic policy, you name it, itÉ??s amazing. Just to have the guts not to be.....",1/25/2020 7:59,18224,79737,,,Trump
1.22107E+18,https://twitter.com/realDonaldTrump/status/1221070106043744256,"....intimidated by this national left wing media, that reduces most politicians and most public figures to whining, crying, puddles of cowardice - it is really something to have a man in the White House who has a courageous heart and does what he says he will do.É?ù",1/25/2020 7:59,12447,55551,,,Trump
1.22087E+18,https://twitter.com/realDonaldTrump/status/1220867760361746432,"It was my honor to welcome our nationÉ??s Mayors to the @ WhiteHouse as we continue to strengthen the bonds of cooperation between federal and local governments so that we can deliver great jobs, excellent schools, affordable healthcare, and safe communities for all of our people!pic.twitter.com/QwYzS32lyQ",1/24/2020 18:35,11129,48787,,,Trump
1.22087E+18,https://twitter.com/realDonaldTrump/status/1220865941434699776,https://twitter.com/March_for_Life/status/1220845061367353345 É??pic.twitter.com/ZPoaFDppg2,1/24/2020 18:28,25734,92987,,,Trump
1.22082E+18,https://twitter.com/realDonaldTrump/status/1220821545746141187,"After consultation with our Great Military Leaders, designers, and others, I am pleased to present the new logo for the United States Space Force, the Sixth Branch of our Magnificent Military!pic.twitter.com/TC8pT4yHFT",1/24/2020 15:31,39827,172166,,,Trump
1.22082E+18,https://twitter.com/realDonaldTrump/status/1220818115354923009,"China has been working very hard to contain the Coronavirus. The United States greatly appreciates their efforts and transparency. It will all work out well. In particular, on behalf of the American People, I want to thank President Xi!",1/24/2020 15:18,28851,127354,,,Trump
1.22077E+18,https://twitter.com/realDonaldTrump/status/1220771079234510850,# MarchForLifehttps://www.pscp.tv/w/cPsqezEyMzE3NDF8MUJSSmpxZ3luWm9Hdzv5ZjVed2-UFjZTaotdcn_Mb9qy1KzQ_Y1355KXU2VI?t=9s É??,1/24/2020 12:11,21056,72583,,,Trump
1.22075E+18,https://twitter.com/realDonaldTrump/status/1220752219601088513,"The Do Nothing Democrats just keep repeating and repeating, over and over again, the same old É??stuffÉ?ù on the Impeachment Hoax. They want to use up ALL of their time, even though it is the wrong thing to do. They ought to go back to work for our great American people!",1/24/2020 10:56,26910,129148,,,Trump
1.22074E+18,https://twitter.com/realDonaldTrump/status/1220742093250932736,READ THE TRANSCRIPTS!,1/24/2020 10:16,17240,93667,,,Trump
1.22073E+18,https://twitter.com/realDonaldTrump/status/1220732371919626240,"More than anything else, the Radical Left, Do Nothing Democrats, like AOC, Omar, CryinÉ?? Chuck, Nervous Nancy & Shifty Schiff, are angry & É??derangedÉ?ù over the fact that Republicans are up to 191 Federal Judges & Two Great New Supreme Court Justices. DonÉ??t blame me, blame Obama!",1/24/2020 9:37,22986,92979,,,Trump
1.22073E+18,https://twitter.com/realDonaldTrump/status/1220725799684399104,Jim is great!https://twitter.com/GreggJarrett/status/1220712020263276545 É??,1/24/2020 9:11,13158,55809,,,Trump
1.22069E+18,https://twitter.com/realDonaldTrump/status/1220692336881160193,"CryinÉ?? Chuck never had what it takes, and never will!https://twitter.com/KimStrassel/status/1220519043766996992 É??",1/24/2020 6:58,12626,48541,,,Trump
1.22069E+18,https://twitter.com/realDonaldTrump/status/1220690251561213952,"The Impeachment Hoax is interfering with the 2020 Election - But that was the idea behind the Radical Left, Do Nothing Dems Scam attack. They always knew I did nothing wrong!",1/24/2020 6:50,20166,91472,,,Trump
1.22069E+18,https://twitter.com/realDonaldTrump/status/1220688087220617218,"É??I often get asked the question, well, isnÉ??t the President going to be stronger and harder to beat if he survives this? The answer is yes, but, the Congress has no choice, it has a Constitutional responsibility.É?ù Joe Biden, pres. candidate. Even Joe agrees with us! @ foxandfriends",1/24/2020 6:41,11442,57335,,,Trump
1.22069E+18,https://twitter.com/realDonaldTrump/status/1220687131292643329,"After having been treated unbelievably unfairly in the House, and then having to endure hour after hour of lies, fraud & deception by Shifty Schiff, CryinÉ?? Chuck Schumer & their crew, looks like my lawyers will be forced to start on Saturday, which is called Death Valley in T.V.",1/24/2020 6:37,17073,73225,,,Trump
1.22069E+18,https://twitter.com/realDonaldTrump/status/1220686655855693824,"....a foreign power, engaged in clandestine intelligence activities, and yet they still asked for the renewal, two more times, and it gave the right for the government to rifle through the Trump campaigns files, & Emails, Text messages.....É?ù So how bad & illegal is that? @ FoxNews",1/24/2020 6:35,10128,35460,,,Trump
1.22069E+18,https://twitter.com/realDonaldTrump/status/1220686650864390145,"Frances Hakes, former Federal prosecutor, É??This is really significant. The FBI had debunked the Steele Dossier in January of 2017, and then even after they did that, even after they knew from the CIA & from their own sources, they knew that Carter Page was not the agent of",1/24/2020 6:35,14576,53480,,,Trump
1.22067E+18,https://twitter.com/realDonaldTrump/status/1220673252764332037,É??HeÉ??s got to explain this. How did Hunter Biden get a billion and a half dollars (from China) to invest when heÉ??d been in business for 60 days?É?ù @ LindseyGrahamSC @ FoxNews,1/24/2020 5:42,23703,89401,,,Trump
1.22067E+18,https://twitter.com/realDonaldTrump/status/1220668770638876672,É??21 State Attorney Generals denouncing the Impeachment of President Trump.É?ù @ FoxNews,1/24/2020 5:24,11194,54684,,,Trump
