id,link,content,date,retweets,favorites,mentions,hashtags,Trump or biden
1.22067E+18,https://twitter.com/realDonaldTrump/status/1220667212387815424,"Jeanne Mancini, President, March for Life: É??We have never had a President of the United States actually come in person to the March for Life.É?ù But now you do! See you later Jeanne. @ HeatherChilders @ FoxNews",1/24/2020 5:18,12565,57464,,,Trump
1.22054E+18,https://twitter.com/realDonaldTrump/status/1220539917660381185,"Carlos will win big, very exciting. Great for Florida, great for USA! He has my complete and total Endorsement!https://twitter.com/CarlosGimenezFL/status/1220427121685864448 É??",1/23/2020 20:52,12911,53162,,,Trump
1.22047E+18,https://twitter.com/realDonaldTrump/status/1220471611477786624,True!https://twitter.com/Yamiche/status/1220466780524765187 É??,1/23/2020 16:21,14070,56771,,,Trump
1.22046E+18,https://twitter.com/realDonaldTrump/status/1220463728535252992,That is a real fan. Thank you!pic.twitter.com/1JWyoyiidW,1/23/2020 15:50,43358,241635,,,Trump
1.22045E+18,https://twitter.com/realDonaldTrump/status/1220454103937167361,"On my way, see you soon!https://twitter.com/CarlosGimenezFL/status/1220427121685864448 É??",1/23/2020 15:11,9768,43029,,,Trump
1.22045E+18,https://twitter.com/realDonaldTrump/status/1220453276275150855,"Crazy Bernie takes the lead in the Democrat Primaries, but it is looking more and more like the Dems will never allow him to win! Will Sleepy Joe be able to stumble across the finish line?",1/23/2020 15:08,21439,118666,,,Trump
1.22045E+18,https://twitter.com/realDonaldTrump/status/1220453267509055490,"Democrats are going to destroy your Social Security. I have totally left it alone, as promised, and will save it!",1/23/2020 15:08,25132,116121,,,Trump
1.22045E+18,https://twitter.com/realDonaldTrump/status/1220452340555309066,"A poll of Radical Left, Do Nothing Democrats just came out in Florida. Nice results!pic.twitter.com/YYo9CxWsVH",1/23/2020 15:04,12143,47261,,,Trump
1.22045E+18,https://twitter.com/realDonaldTrump/status/1220452007389155328,I LOVE ALABAMA!pic.twitter.com/ZDlBDehhvN,1/23/2020 15:03,8688,37002,,,Trump
1.22045E+18,https://twitter.com/realDonaldTrump/status/1220451771572785157,Interesting poll in Texas-13! # TX13pic.twitter.com/80uS2VaPGP,1/23/2020 15:02,6037,23011,,,Trump
1.22045E+18,https://twitter.com/realDonaldTrump/status/1220451535005671428,Close race in Kansas!pic.twitter.com/m2ExF9vHKU,1/23/2020 15:01,5686,21759,,,Trump
1.22044E+18,https://twitter.com/realDonaldTrump/status/1220444653348098048,É??President Trump shows us that electability is no match for electricityÉ?ù by @ KellyannePollshttps://www.washingtonpost.com/opinions/2020/01/23/kellyanne-conway-oped-trump-electability-democrats/ É??,1/23/2020 14:34,8978,36604,,,Trump
1.22044E+18,https://twitter.com/realDonaldTrump/status/1220442676081963010,É??The Democrats have now conceded that President Trump has not committed a crime.É?ù @ AriFleischer,1/23/2020 14:26,21254,91725,,,Trump
1.22043E+18,https://twitter.com/realDonaldTrump/status/1220428541197799424,The United States looks forward to welcoming Prime Minister @ Netanyahu & Blue & White Chairman @ Gantzbe to the @ WhiteHouse next week. Reports about details and timing of our closely-held peace plan are purely speculative.,1/23/2020 13:30,11802,49028,,,Trump
1.22041E+18,https://twitter.com/realDonaldTrump/status/1220410391668371457,"The Democrats donÉ??t want a Witness Trade because Shifty Schiff, the BidenÉ??s, the fake Whistleblower(& his lawyer), the second Whistleblower (who vanished after I released the Transcripts), the so-called É??informerÉ?ù, & many other Democrat disasters, would be a BIG problem for them!",1/23/2020 12:18,24525,97845,,,Trump
1.22038E+18,https://twitter.com/realDonaldTrump/status/1220379537155948544,"É??This is all about undermining the next Election.É?ù Liz Peek, @ FoxNews",1/23/2020 10:15,19268,90680,,,Trump
1.22034E+18,https://twitter.com/realDonaldTrump/status/1220336691539599361,"Mini Mike Bloomberg is playing poker with his foolhardy and unsuspecting Democrat rivals. He says that if he loses (he really means when!) in the primaries, he will spend money helping whoever the Democrat nominee is. By doing this, he figures, they wonÉ??t hit him as hard....",1/23/2020 7:25,17151,77618,,,Trump
1.22034E+18,https://twitter.com/realDonaldTrump/status/1220336692378394624,"....during his hopeless É??presidentialÉ?ù campaign. They will remain silent! The fact is, when Mini losses, he will be spending very little of his money on these É??clownsÉ?ù because he will consider himself to be the biggest clown of them all - and he will be right!",1/23/2020 7:25,10636,47961,,,Trump
1.22033E+18,https://twitter.com/realDonaldTrump/status/1220329778810687489,"The Democrats & Shifty Schiff, whose presentation to the Senate was loaded with lies and misrepresentations, are refusing to state that the Obama Administration withheld aid from many countries including Ukraine, Pakistan, Philippines, Egypt, Honduras, & Mexico. Witch Hunt!",1/23/2020 6:57,21334,73636,,,Trump
1.22033E+18,https://twitter.com/realDonaldTrump/status/1220328946736226305,"No matter what you give to the Radical Left, Do Nothing Democrats, it will never be enough!",1/23/2020 6:54,19954,104030,,,Trump
1.22033E+18,https://twitter.com/realDonaldTrump/status/1220328518288052225,"The Democrat House would not give us lawyers, or not one witness, but now demand that the Republican Senate produce the witnesses that the House never sought, or even asked for? They had their chance, but pretended to rush. Most unfair & corrupt hearing in Congressional history!",1/23/2020 6:52,28044,126080,,,Trump
1.22033E+18,https://twitter.com/realDonaldTrump/status/1220327641364029440,"In an Impeachment, you canÉ??t use a work of fiction as the theory for the case, filling in gaps with presumptions against the President. It was a weak presentation, self indulgent, & he didnÉ??t deliver the goods.É?ù Robert Charles, @ HeatherChilders @ FoxNews",1/23/2020 6:49,13339,54643,,,Trump
1.22033E+18,https://twitter.com/realDonaldTrump/status/1220326875882577921,"....OF THE 2020 ELECTION BECSUSE IT WEAPONIZES A PROCESS THAT SHOULD ONLY BE INITIATED IN EXCEEDINGLY RARE CIRCUMSTANCES, AND SHOULD NEVER BE USED FOR PARTISAN PURPOSES.É?ù @ HeatherChilders @ FoxNews The Democrats are trying hard to damage Republicans prior to the Election!",1/23/2020 6:46,11022,42492,,,Trump
1.22033E+18,https://twitter.com/realDonaldTrump/status/1220326789182033920,"Attorney Generals from 21 States are urging the Senate to reject Impeachment. They say the Articles have legal & factual problems, and the Democrats case sets a dangerous historical precedent. É??EVEN AN UNSUCCESSFUL EFFORT TO IMPEACH THE PRESIDENT UNDERMINES THE INTEGRITY.....",1/23/2020 6:45,19735,77269,,,Trump
1.22033E+18,https://twitter.com/realDonaldTrump/status/1220325842330537984,"É??There is no evidence of a crime.É?ù Robert Charles, Fmr Asst Secy of State. The crimes were committed by the other side!",1/23/2020 6:42,16082,70328,,,Trump
1.22033E+18,https://twitter.com/realDonaldTrump/status/1220325126186598400,"É??Schiff doesnÉ??t have a case telling the truth, so heÉ??s manufacturing things.É?ù Rush Limbaugh @ foxandfriends",1/23/2020 6:39,15658,71379,,,Trump
1.22011E+18,https://twitter.com/realDonaldTrump/status/1220107185276907521,"Sorry, if you come you will be immediately sent back!https://twitter.com/DHSgov/status/1220103171403665410 É??",1/22/2020 16:13,25343,101235,,,Trump
1.22011E+18,https://twitter.com/realDonaldTrump/status/1220105021930426368,See you on Friday...Big Crowd!https://twitter.com/March_for_Life/status/1091025377932263427 É??,1/22/2020 16:04,25045,99651,,,Trump
1.2201E+18,https://twitter.com/realDonaldTrump/status/1220099650461392896,True!https://twitter.com/RandPaul/status/1220044346373877761 É??,1/22/2020 15:43,12340,51754,,,Trump
1.22007E+18,https://twitter.com/realDonaldTrump/status/1220073313768099840,É??NO PRESSUREÉ?ù,1/22/2020 13:58,20400,124620,,,Trump
1.22006E+18,https://twitter.com/realDonaldTrump/status/1220061617561300994,Will be Great!https://twitter.com/WhiteHouse/status/1219708789957578752 É??,1/22/2020 13:12,8296,40324,,,Trump
1.22006E+18,https://twitter.com/realDonaldTrump/status/1220060590703611907,Great working with you Maria!https://twitter.com/MariaBartiromo/status/1219736663930417155 É??,1/22/2020 13:08,7797,37289,,,Trump
1.22004E+18,https://twitter.com/realDonaldTrump/status/1220044230065655808,"One of the many great things about our just signed giant Trade Deal with China is that it will bring both the USA & China closer together in so many other ways. Terrific working with President Xi, a man who truly loves his country. Much more to come!",1/22/2020 12:03,19991,104527,,,Trump
1.22002E+18,https://twitter.com/realDonaldTrump/status/1220018651362779136,"Heading back to Washington from @ Davos , Switzerland. Very successful (for USA) trip!",1/22/2020 10:21,12146,62744,,,Trump
1.22002E+18,https://twitter.com/realDonaldTrump/status/1220017667387445248,É??Not the SenateÉ??s job to mop up the mess made in the House by the Democrats. Biden admitted that he went to Ukraine and did the Quid Pro Quo.É?ù @ SteveScalise @ FoxNews,1/22/2020 10:17,22493,91643,,,Trump
1.22001E+18,https://twitter.com/realDonaldTrump/status/1220013726935351296,THANK YOU @ WEF!pic.twitter.com/rQWBqJy7za,1/22/2020 10:01,19938,71620,,,Trump
1.21997E+18,https://twitter.com/realDonaldTrump/status/1219974660915388416,They are taking the nomination away from Bernie for a second time. Rigged!,1/22/2020 7:26,22431,136784,,,Trump
1.21997E+18,https://twitter.com/realDonaldTrump/status/1219973879692713989,Steyer is a major loser. Just doesnÉ??t get it. This is second time with Bernie!https://twitter.com/BretBaier/status/1219331040361271297 É??,1/22/2020 7:23,6989,32628,,,Trump
1.21997E+18,https://twitter.com/realDonaldTrump/status/1219966918725074944,Big story. Hope Fake News covers it!https://twitter.com/JennaEllisEsq/status/1219842534605754368 É??,1/22/2020 6:55,9132,32240,,,Trump
1.21996E+18,https://twitter.com/realDonaldTrump/status/1219963910620680192,Their case was so É??overwhelmingÉ?ù in the House that they need & demand Witnesses in the Senate!https://twitter.com/senatemajldr/status/1219790888714612738 É??,1/22/2020 6:43,10676,41070,,,Trump
1.21992E+18,https://twitter.com/realDonaldTrump/status/1219916272441470976,ENJOY!https://twitter.com/MariaBartiromo/status/1219909745450065920 É??,1/22/2020 3:34,6408,27799,,,Trump
1.21992E+18,https://twitter.com/realDonaldTrump/status/1219915807217659905,"Will be interviewed at 5:00 A.M. Eastern by @ JoeSquawk on @ CNBC at the World Economic Forum in Davos, Switzerland. Enjoy!",1/22/2020 3:32,4943,24067,,,Trump
1.21987E+18,https://twitter.com/realDonaldTrump/status/1219874467540799488,"Making great progress in @ Davos. Tremendous numbers of companies will be coming, or returning, to the USA. Hottest Economy! JOBS, JOBS, JOBS!",1/22/2020 0:48,18084,90037,,,Trump
1.21985E+18,https://twitter.com/realDonaldTrump/status/1219854522236968961,Wow!https://twitter.com/NRSC/status/1219661000556847107 É??,1/21/2020 23:29,16871,59645,,,Trump
1.2197E+18,https://twitter.com/realDonaldTrump/status/1219698190129225728,READ THE TRANSCRIPTS!,1/21/2020 13:08,31305,169056,,,Trump
1.21961E+18,https://twitter.com/realDonaldTrump/status/1219611860468670469,Congratulations on your big @ UFC WIN!https://twitter.com/TheNotoriousMMA/status/1219461358967762944 É??,1/21/2020 7:25,20880,142959,,,Trump
1.21944E+18,https://twitter.com/realDonaldTrump/status/1219439427488866305,THE BEST IS YET TO COME!pic.twitter.com/YBMOBurdHQ,1/20/2020 19:59,42667,134425,,,Trump
1.21944E+18,https://twitter.com/realDonaldTrump/status/1219435907775791104,"É??ItÉ??s about the Economy, stupidÉ?ù, except when it comes to Trump. The fact is, the Fake News Media hates talking about the Economy, and how incredible it is!",1/20/2020 19:45,28042,142865,,,Trump
1.21943E+18,https://twitter.com/realDonaldTrump/status/1219433612753289216,"Everyone said it couldnÉ??t be done. But for the first time in a generation, there will be direct flights between Serbia and Kosovo. Another win. Thanks to @ WHNSC Ambassador Robert OÉ??Brien and Ambassador @ RichardGrenell!pic.twitter.com/0qSLryG96B",1/20/2020 19:36,13289,54513,,,Trump
1.21943E+18,https://twitter.com/realDonaldTrump/status/1219431143067377664,"Representative Randy Weber ( @ TxRandy14) of Texas has been a HUGE supporter of our # MAGA Agenda from the very beginning. Strong on Crime, the Border, Illegal Immigration, the 2nd Amendment, and our great Military & Vets! Randy has my Full Endorsement!",1/20/2020 19:26,13424,44622,,,Trump
1.21943E+18,https://twitter.com/realDonaldTrump/status/1219430958769664002,"Representative John Carter ( @ JudgeJohnCarter) from the Great State of Texas has been a tremendous supporter of our # MAGA Agenda. He is strong on Crime and Borders, great for our Military and our Vets, and Strong on our # 2A. John has my Complete and Total Endorsement!",1/20/2020 19:26,13315,45379,,,Trump
1.21943E+18,https://twitter.com/realDonaldTrump/status/1219430494460268544,"Texas Rep Roger Williams ( @ RepRWilliams) has done an incredible job representing the Great State of Texas. Roger is tough on Crime, Strong on the Border & Illegal Immigration. He loves our Military & our Vets and protects our # 2A. Roger has my Total & Complete Endorsement!",1/20/2020 19:24,13720,47617,,,Trump
1.21942E+18,https://twitter.com/realDonaldTrump/status/1219424278216470528,"Heading to Davos, Switzerland, to meet with World and Business Leaders and bring Good Policy and additional Hundreds of Billions of Dollars back to the United States of America! We are now NUMBER ONE in the Universe, by FAR!!",1/20/2020 18:59,24192,119552,,,Trump
1.21942E+18,https://twitter.com/realDonaldTrump/status/1219420903047479297,Excellent!https://twitter.com/EmmanuelMacron/status/1219329693863772160 É??,1/20/2020 18:46,11007,50729,,,Trump
1.2194E+18,https://twitter.com/realDonaldTrump/status/1219402353457102850,https://www.breitbart.com/politics/2020/01/20/poll-majority-oppose-conviction-removal-in-trump-impeachment/ É??,1/20/2020 17:32,13736,55702,,,Trump
1.21939E+18,https://twitter.com/realDonaldTrump/status/1219394967304581120,Nancy canÉ??t fix it. The Do Nothing Dems have done great harm to our Country!https://twitter.com/MariaBartiromo/status/1218181208909193220 É??,1/20/2020 17:03,19894,75396,,,Trump
1.21935E+18,https://twitter.com/realDonaldTrump/status/1219351907627667456,"I will NEVER allow our great Second Amendment to go unprotected, not even a little bit!",1/20/2020 14:12,49063,247221,,,Trump
1.21935E+18,https://twitter.com/realDonaldTrump/status/1219348788973838336,"It was exactly three years ago today, January 20, 2017, that I was sworn into office. So appropriate that today is also MLK jr DAY. African-American Unemployment is the LOWEST in the history of our Country, by far. Also, best Poverty, Youth, and Employment numbers, ever. Great!",1/20/2020 13:59,37095,193643,,,Trump
1.21933E+18,https://twitter.com/realDonaldTrump/status/1219332022826606592,...And they say you can add 7% to 10% to all Trump numbers! Who knows?https://twitter.com/realDonaldTrump/status/1217927213179338758 É??,1/20/2020 12:53,19657,92581,,,Trump
1.21933E+18,https://twitter.com/realDonaldTrump/status/1219330940461309952,"Two stone cold losers from Amazon WP. Almost every story is a made up lie, just like corrupt pol Shifty Schiff, who fraudulently made up my call with Ukraine. Fiction!https://twitter.com/realDonaldTrump/status/1218673508911403008 É??",1/20/2020 12:48,14536,57661,,,Trump
1.2193E+18,https://twitter.com/realDonaldTrump/status/1219304652438675456,USA! USA! USA!,1/20/2020 11:04,56666,310553,,,Trump
1.21929E+18,https://twitter.com/realDonaldTrump/status/1219286662221651970,"CryinÉ?? Chuck Schumer is now asking for É??fairnessÉ?ù, when he and the Democrat House members worked together to make sure I got ZERO fairness in the House. So, what else is new?",1/20/2020 9:52,25521,125731,,,Trump
1.21929E+18,https://twitter.com/realDonaldTrump/status/1219285375736328192,They didnÉ??t want John Bolton and others in the House. They were in too much of a rush. Now they want them all in the Senate. Not supposed to be that way!,1/20/2020 9:47,19381,102211,,,Trump
1.21928E+18,https://twitter.com/realDonaldTrump/status/1219284434635100162,"The Democrat Party in the Great Commonwealth of Virginia are working hard to take away your 2nd Amendment rights. This is just the beginning. DonÉ??t let it happen, VOTE REPUBLICAN in 2020!",1/20/2020 9:43,29881,116002,,,Trump
1.21908E+18,https://twitter.com/realDonaldTrump/status/1219076533354037249,A great show! Check it out tonight at 9pm. @ FoxNewshttps://twitter.com/NextRevFNC/status/1218941188704632832 É??,1/19/2020 19:57,9040,42236,,,Trump
1.21907E+18,https://twitter.com/realDonaldTrump/status/1219066007731310593,"É??In the House, the President got less due process than the 9-11 terrorists got. This is a corrupt process?É?ù Mark Levin @ marklevinshow É??Very much so!É?ù @ RepDougCollins @ FoxNews",1/19/2020 19:16,23675,98905,,,Trump
1.21905E+18,https://twitter.com/realDonaldTrump/status/1219053709428248576,"I was thrilled to be back in the Great State of Texas tonight, where the people are known for being tough, strong, hardworking, loyal and fiercely patriotic É?? just like AmericaÉ??s incredible Farmers! # AFBF2020https://www.pscp.tv/w/cPTqejFvTlFsTFJub1dwUXd8MUx5eEJMV09yYllHTlRz-5NbV2gPeKOOkDEM8yurjH1YctdRkh2JVPtJ_Se1?t=5m20s É??",1/19/2020 18:27,18102,76084,,,Trump
1.219E+18,https://twitter.com/realDonaldTrump/status/1219004689716412416,"Now Mini Mike Bloomberg is critical of Jack Wilson, who saved perhaps hundreds of people in a Church because he was carrying a gun, and knew how to use it. Jack quickly killed the shooter, who was beginning a rampage. Mini is against the 2nd A. His ads are Fake, just like him!",1/19/2020 15:12,38852,165062,,,Trump
1.21896E+18,https://twitter.com/realDonaldTrump/status/1218962544372670467,I have never seen the Republican Party as Strong and as Unified as it is right now. Thank you!,1/19/2020 12:24,35166,238596,,,Trump
1.21895E+18,https://twitter.com/realDonaldTrump/status/1218952496388956162,"I will be going to Austin, Texas. Leaving soon. Always like (love!) being in the Lone Star State. Speaking to our great Farmers. They hit É??paydirtÉ?ù with our incredible new Trade Deals: CHINA, JAPAN, MEXICO, CANADA, SOUTH KOREA, and many others!",1/19/2020 11:44,23846,127793,,,Trump
1.21872E+18,https://twitter.com/realDonaldTrump/status/1218717833552711680,"É??Nancy Pelosi said, itÉ??s not a question of proof, itÉ??s a question of allegations! Oh really?É?ù @ JudgeJeanine @ FoxNews What a disgrace this Impeachment Scam is for our great Country!",1/18/2020 20:12,36620,158443,,,Trump
1.2187E+18,https://twitter.com/realDonaldTrump/status/1218697758728769536,"If you listened to the flawed advice of @ paulkrugman at the @ nytimes, a newspaper that was going broke until I came along, you would have entirely missed the RECORD BREAKING Stock Market (and other) numbers produced since Election Day, 2016. Sorry, those are the FACTS.....",1/18/2020 18:52,17683,75260,,,Trump
1.2187E+18,https://twitter.com/realDonaldTrump/status/1218697697512820736,....BUT THE BEST IS YET TO COME!,1/18/2020 18:52,35520,185142,,,Trump
1.21867E+18,https://twitter.com/realDonaldTrump/status/1218674016942219265,"A massive 200 Billion Dollar Sea Wall, built around New York to protect it from rare storms, is a costly, foolish & environmentally unfriendly idea that, when needed, probably wonÉ??t work anyway. It will also look terrible. Sorry, youÉ??ll just have to get your mops & buckets ready!",1/18/2020 17:18,24902,124267,,,Trump
1.21867E+18,https://twitter.com/realDonaldTrump/status/1218673508911403008,"Another Fake Book by two third rate Washington Post reporters, has already proven to be inaccurately reported, to their great embarrassment, all for the purpose of demeaning and belittling a President who is getting great things done for our Country, at a record clip. Thank you!",1/18/2020 17:16,22957,114955,,,Trump
1.21867E+18,https://twitter.com/realDonaldTrump/status/1218668999086694400,"They are taking the Democrat Nomination away from Crazy Bernie, just like last time. Some things never change!",1/18/2020 16:58,22552,117077,,,Trump
1.21867E+18,https://twitter.com/realDonaldTrump/status/1218668469597675520,"95% Approval Rating in the Republican Party, A Record. Thank You!",1/18/2020 16:56,24208,146206,,,Trump
1.21853E+18,https://twitter.com/realDonaldTrump/status/1218527317116575744,É??Trade Deals Drive Stocks To Record Highs.É?ù @ FoxNews,1/18/2020 7:35,17723,88329,,,Trump
1.21853E+18,https://twitter.com/realDonaldTrump/status/1218526759462801413,"É??Day after day, really good news on the economy. By the way, this didnÉ??t just happen by accident, itÉ??s the result of a lot of the policies that Donald Trump has put into place. Obviously, the Tax Cut, and now we have these two BIG trade deals.É?ù @ StephenMoore Great future growth!",1/18/2020 7:33,18447,81296,,,Trump
1.21852E+18,https://twitter.com/realDonaldTrump/status/1218523265821544450,"Tremendous surge in new housing construction in December, 16.9%, biggest in many years!",1/18/2020 7:19,22259,120157,,,Trump
1.21852E+18,https://twitter.com/realDonaldTrump/status/1218520880051105792,"A great day at the White House for our National Champions, the LSU Tigers!https://twitter.com/Real10jayy__/status/1218313039432290305 É??",1/18/2020 7:09,17412,97679,,,Trump
1.21834E+18,https://twitter.com/realDonaldTrump/status/1218336685450317824,CONGRATULATIONS! # GeauxTigerspic.twitter.com/Axc9ezAdar,1/17/2020 18:57,20394,99919,,,Trump
1.21831E+18,https://twitter.com/realDonaldTrump/status/1218309736594116608,???Ò???? ???™???? ?????Ò?????? ???? ?õ???Ò?????? ?Ò?? ???????¶ ???? ?????Ò?????? ???˝???????Ò ???????¶?? ?????¶???? ???? ?????? ???˝ ?¶???Ò???˝ ???Ò ?????¶?? ?õ?????? ???? ?™?Ò?? ?????¶?Ò???? ???????????? ???? ?õ?????? ?????? ?????? ?¶?? ???? ?Ò?????????????????? ?????¶ ??????????. ?Ò?????Ò???? ?????Ò???? ???? ?™???? ?õ?? ???? ?????Ò???? ?Ò?? ???? ?????¶ ?????Ò?????? ???????????????? ???????? ???Ò???? ???Å?????? ?Ò?? ???????Ò ?????????? ?? ?????Ò???? ?Ò?? ?????????Ò?? ???????????¶ ????????!https://twitter.com/khamenei_ir/status/1218141834842660864 É??,1/17/2020 17:10,25294,97993,,,Trump
1.21831E+18,https://twitter.com/realDonaldTrump/status/1218309612304248834,"The noble people of IranÉ??who love AmericaÉ??deserve a government that's more interested in helping them achieve their dreams than killing them for demanding respect. Instead of leading Iran toward ruin, its leaders should abandon terror and Make Iran Great Again!https://twitter.com/khamenei_ir/status/1218141834842660864 É??",1/17/2020 17:10,20856,76103,,,Trump
1.2183E+18,https://twitter.com/realDonaldTrump/status/1218297464941314049,"Your 2nd Amendment is under very serious attack in the Great Commonwealth of Virginia. ThatÉ??s what happens when you vote for Democrats, they will take your guns away. Republicans will win Virginia in 2020. Thank you Dems!",1/17/2020 16:22,47336,174160,,,Trump
1.2183E+18,https://twitter.com/realDonaldTrump/status/1218297466656829440,"The so-called É??Supreme LeaderÉ?ù of Iran, who has not been so Supreme lately, had some nasty things to say about the United States and Europe. Their economy is crashing, and their people are suffering. He should be very careful with his words!",1/17/2020 16:22,33783,171078,,,Trump
1.2183E+18,https://twitter.com/realDonaldTrump/status/1218297460185030658,Words of wisdom. Thank you Ted!https://twitter.com/SenTedCruz/status/1217855192399601665 É??,1/17/2020 16:22,19423,78639,,,Trump
1.21826E+18,https://twitter.com/realDonaldTrump/status/1218264289225728000,Heading to Florida for big Republican Party event. New Stock Market Record. Jobs in USA at all-time high!,1/17/2020 14:10,19704,109619,,,Trump
1.2182E+18,https://twitter.com/realDonaldTrump/status/1218195035646242820,"....Joe Biden, and Bernie is shut out again. Very unfair, but thatÉ??s the way the Democrats play the game. Anyway, itÉ??s a lot of fun to watch!",1/17/2020 9:35,13941,68933,,,Trump
1.2182E+18,https://twitter.com/realDonaldTrump/status/1218195021930926082,"They are rigging the election again against Bernie Sanders, just like last time, only even more obviously. They are bringing him out of so important Iowa in order that, as a Senator, he sit through the Impeachment Hoax Trial. Crazy Nancy thereby gives the strong edge to Sleepy...",1/17/2020 9:35,25750,116128,,,Trump
1.21819E+18,https://twitter.com/realDonaldTrump/status/1218190672064319488,"Getting ready to meet the LSU Tigers, the National Champions. Great Coach, great Team, great School. Very exciting!",1/17/2020 9:17,15681,122553,,,Trump
1.21817E+18,https://twitter.com/realDonaldTrump/status/1218174158280019968,"Mini Mike Bloomberg ads are purposely wrong - A vanity project for him to get into the game. Nobody in many years has done for the USA what I have done for the USA, including the greatest economy in history, rebuilding our military, biggest ever tax & regulation cuts, & 2nd A!",1/17/2020 8:12,23660,113982,,,Trump
1.21817E+18,https://twitter.com/realDonaldTrump/status/1218165916451602432,"Mini Mike Bloomberg doesnÉ??t get on the Democrat Debate Stage because he doesnÉ??t want to - he is a terrible debater and speaker. If he did, he would go down in the polls even more (if that is possible!).",1/17/2020 7:39,15554,77303,,,Trump
